{
  "$comment": "Per-phase model preference for loom-sdlc panels. Panel shape is enforced by each phase's min_panel: the resolver dedupes to one model per vendor, so min_panel is the distinct-vendor floor; plus rules.exclude_author_vendor. This file expresses preference; resolve-panel.sh reconciles it against live credentials. Model ids drift: re-check with dispatch-subagents/scripts/list-models.sh.",
  "author_default": "anthropic/claude-fable-5",
  "rules": {
    "exclude_author_vendor": true
  },
  "phases": {
    "plan_review": {
      "min_panel": 2,
      "prefer": ["openai-codex/gpt-5.5", "deepseek/deepseek-v4-pro", "amazon-bedrock/global.anthropic.claude-opus-4-8", "zai-coding-cn/glm-5.2"]
    },
    "spec_review": {
      "min_panel": 2,
      "prefer": ["amazon-bedrock/global.anthropic.claude-opus-4-8", "openai-codex/gpt-5.5", "deepseek/deepseek-v4-pro", "zai-coding-cn/glm-5.2", "moonshotai/kimi-k2.7-code"]
    },
    "pr_review": {
      "min_panel": 3,
      "prefer": ["amazon-bedrock/global.anthropic.claude-opus-4-8", "openai-codex/gpt-5.5", "deepseek/deepseek-v4-pro", "zai-coding-cn/glm-5.2", "moonshotai/kimi-k2.7-code"]
    },
    "task_validate": {
      "min_panel": 1,
      "prefer": ["deepseek/deepseek-v4-flash", "anthropic/claude-haiku-4-5"]
    }
  }
}
