{
  "$comment": "Per-phase model preference for sdlc panels. Panel shape is enforced by each phase's min_panel: the resolver dedupes to one model per vendor, so min_panel is the distinct-vendor floor; plus rules.exclude_author_vendor. This file expresses preference; resolve-panel reconciles it against live credentials. Model ids drift: re-check with your model-list tooling. Each prefer entry may optionally carry pi's ':<thinking>' suffix (off/minimal/low/medium/high/xhigh/max), e.g. 'openai/gpt-5:high', to set that model's reasoning level for the phase — see plan_review below for an example. Not validated against the level enum on purpose (see the schema description): some providers use trailing colons for other things, e.g. Bedrock version suffixes.",
  "author_default": "anthropic/claude-sonnet-4",
  "rules": {
    "exclude_author_vendor": true
  },
  "phases": {
    "plan_review": {
      "min_panel": 2,
      "prefer": ["openai/gpt-5:high", "deepseek/deepseek-v3", "anthropic/claude-opus-4:high"]
    },
    "spec_review": {
      "min_panel": 2,
      "prefer": ["anthropic/claude-opus-4", "openai/gpt-5", "deepseek/deepseek-v3"]
    },
    "pr_review": {
      "min_panel": 3,
      "prefer": ["anthropic/claude-opus-4", "openai/gpt-5", "deepseek/deepseek-v3", "zai/glm-4"]
    },
    "task_validate": {
      "min_panel": 1,
      "prefer": ["deepseek/deepseek-v3", "anthropic/claude-haiku-4"]
    }
  }
}
